agency,code,description,unit,zone_a,zone_b,zone_c,zone_d
PWD,09.25.2.3,"Driving pre-cast pile of 450 mm x 450 mm X-section made with shoe/ without shoe by hydraulic static pile driver of approx. 500 tonne (metric ton) capacity; arranged with necessary cranes, power source, maintaining driving log and record of pressure exerted on piles driven in to desired RL or capacity level ; complete in all respect including handling of piles, dressing & leveling of site, way making, surveying, layout setting etc ended with the submission of pile driving report in three copies duly signed by professional engineer and approved by the Engineer-in-charge.",meter,1042.0,0,1039.0,0
PWD,09.26,Mobilization and demobilization of Crane (crawler) and crane mounted Vibratory Hammer complete rig set.,per set,149206.0,0,149206.0,0
PWD,09.27,"Supplying U-shape hot rolled steel sheet pile of specified sections having chemical composition Phosphorus = 0.04% (Maximum), Sulphur = 0.04% (Maximum), and mechanical properties Tensile strength=> 490 N/mm2, Yield strength => 296 N/mm2, Elongation = 15% (Minimum) (according to ASTM Standards), as specified by appropriate means to the construction site and stacking at proper place including loading, unloading, local handling as per specifications, including all taxes, freights, incidental charges etc. complete as per direction of the Engineer-in-charge. U-shape, hot-rolled steel sheet pile width = 400mm to 600mm: height => 100mm, length = 12.0m, Thickness >= 10.5mm, Thickness >= 13.0mm (±0.50mm), Thickness >= 15.5mm (±0.50mm), Thickness >= 17.0mm (±0.50mm) This rate excludes the cost of bed preparation. Sheet piles have to be unloaded on a firm flat base. (Salvage materials shall be the contractor’s property after completion of the work, rate is excluding the cost of driving and taking out).",kg,52.0,52.0,0,0
PWD,09.28,"Cutting (if necessary) charge of U-type Hot rolled steel sheet piles to design length and shape as per design and specification (thickness, length and mechanical properties) and instruction by all complete as per direction of the Engineer-in-charge.",each,358.0,358.0,0,0
PWD,09.29,"Jointing steel sheet piles (if necessary) of different thickness by welding along width (both sides) and along collars (outside) (i.e. at 4 points) to increase the length of pile as per requirement including necessary modification of the ends to receive the weld, supply of welding materials, equipments and other accessories as per specification and direction of Engineer in charge.",each,476.0,476.0,0,0
PWD,09.30,"Fabrication and construction of corner Joints in steel sheet piles including cutting, welding, shaping as per design and specification and as per requirement including supply of necessary welding materials, equipments and other accessories as per specification and direction of Engineer in charge.",each,221.0,221.0,0,0
PWD,09.31.1,"Driving steel sheet piles (up to 6.0m depth) of various sections and weights in any type of soil by mechanical device (Crawler Crane having 50 to 55 Ton capacity and Vibratory Hammer etc.) including handling and placing in position, supply of all materials and equipments related with driving of sheet piles, correcting leaning beyond tolerance and other defects etc. all complete as per direction of Engineer in charge (measurement will be taken on projected width x height).",sqm,1109.0,1109.0,0,0
PWD,09.31.2,"Driving steel sheet piles (beyond 6.0m up to 9.0m depth) of various sections and weights in any type of soil by mechanical device (Crawler Crane having 50 to 55 Ton capacity and Vibratory Hammer etc.) including handling and placing in position, supply of all materials and equipments",sqm,1024.0,1024.0,0,0
PWD,09.31.3,"Driving steel sheet piles (beyond 9.0m up to 12.0m depth) of various sections and weights in any type of soil by mechanical device (Crawler Crane having 50 to 55 Ton capacity and Vibratory Hammer etc.) including handling and placing in position, supply of all materials and equipments related with driving of sheet piles, correcting leaning beyond tolerance and other defects etc. all complete as per direction of Engineer in charge. (Measurement will be taken on projected width x height).",sqm,999.0,999.0,0,0
PWD,09.32.1,"Lifting steel sheet piles (up to 6.0m depth) of any section and weights from any type of soil by mechanical device including supply of all equipments etc., handling and placing in stacks etc. all complete as per direction of Engineer in charge. (Measurement will be taken on projected width x height).",sqm,910.0,910.0,0,0
PWD,09.32.2,"Lifting steel sheet piles (beyond 6.0m up to 9.0m depth) of any section and weights from any type of soil by mechanical device including supply of all equipments etc., handling and placing in stacks etc. all complete as per direction of Engineer in charge. (Measurement will be taken on projected width x height).",sqm,943.0,943.0,0,0
PWD,09.32.3,"Lifting steel sheet piles (beyond 9.0m up to 12.0m depth) of any section and weights from any type of soil by mechanical device including supply of all equipments etc., handling and placing in stacks etc. all complete as per direction of Engineer in charge (measurement will be taken on projected width x height).",sqm,1061.0,1061.0,0,0
PWD,09.33,Mobilization & demobilization of joist driving rig,per set,9473.0,9473.0,0,0
PWD,09.34,"Driving joist (up to 6.5m depth) of any sections and weights in any type of soil by mechanical device including handling and placing in position, supply of all materials and equipments related with driving of sheet piles, correcting leaning beyond tolerance and other defects etc. all complete as per direction of Engineer in charge (measurement will be taken on meter).",meter,383.0,383.0,0,0
PWD,10.1,"Supply and fixing of galvanized anchor bolts of variable dia for rigid frame conforming to ASTM F1554 Grade 55, Galvanized to A153, Class C or equivalent with minimum yield strength of 380 MPa, manual of steel construction by American Institute of Steel Construction (AISC) etc. including the cost of washer & bolts, material testing etc. all complete as per drawing, specification and direction of the Engineer- in-charge.",kg,192.0,192.0,192.0,192.0
PWD,10.2,"Supply, fabrication and installation of built-up sections i.e. columns, beams, rafters, bracings, struts etc. (up to level-4) from steel plates conforming to ASTM A572, with a minimum yield strength of 345 MPa, including the cost of testing of plates, application of red/grey-oxide primer etc. all complete as per drawing, specification and direction of Engineer-in- charge.",kg,137.0,137.0,137.0,137.0
PWD,10.3,"Supply, fabrication and installation of built-up sections i.e. columns, beams, rafters, bracings, struts etc. (up to level-4) from steel plates conforming to ASTM A36, with a minimum yield strength of 250 MPa, including the cost of testing of plates, application of red/grey-oxide primer etc. all complete as per drawing, specification and direction of Engineer-in- charge.",kg,134.0,134.0,134.0,134.0
PWD,10.4,"Supply, fabrication and installation of hot-rolled sections (W, H, I-shape etc.) for columns, beams, rafters, bracings etc. (up to level-4) conforming to ASTM A36, with a minimum yield strength of 250 MPa, including the cost of testing of plates, application of red/grey-oxide primer etc. all complete as per drawing, specification and direction of Engineer-in- charge.",kg,131.0,131.0,131.0,131.0
PWD,10.5,"Supply, fabrication and installation of hot rolled structural grade steel pipe and tube of any thickness conforming to ASTM A283 with a minimum yield strength of 275 MPa, including the cost of testing, application of red/grey-oxide primer etc. (up to level-4) all complete as per drawing, specification and direction of Engineer-in-charge.",kg,200.0,200.0,200.0,200.0
PWD,10.6,"Supply, fabrication and installation of hot rolled structural grade steel channel and angle in roof truss or any form of structure of any thickness conforming to ASTM A36 with a minimum yield strength of 250 MPa, including the cost of testing, application of red/grey-oxide primer etc. (up to level- 4) all complete as per drawing, specification and direction of Engineer-in-charge.",kg,129.0,129.0,129.0,129.0
PWD,10.7,"Supply and fabrication of built-up sections for shore piles from steel plates conforming to ASTM A36, with a minimum yield strength of 250 MPa, including the cost of testing of plates, application of red/grey-oxide primer etc. all complete as per drawing, specification and direction of Engineer-in- charge.",kg,68.0,68.0,68.0,68.0
PWD,10.8,"Supply and fabrication of hot rolled structural grade steel Sections of any thickness conforming to ASTM A36 with a minimum yield strength of 250 MPa for shore piling, including the cost of testing, application of red/grey-oxide primer etc. all complete as per drawing, specification and direction of Engineer-in-charge. (Salvage materials shall be the contractors property after completion of work, rate is excluding the cost of driving and taking out).",kg,53.0,53.0,53.0,53.0
PWD,10.9,"Supply, fabrication, installation and de-installation of built- up sections for shore pile bracing at any level basement work from steel plates conforming to ASTM A36, with a minimum yield strength of 250 MPa, including the cost of testing of plates, application of red/grey-oxide primer etc. all complete as per drawing, specification and direction of Engineer-in-charge. (Salvage materials shall be the contractors property after completion of work).",kg,88.0,88.0,88.0,88.0
PWD,10.10,"Supply, fabrication, installation and de-installation of built- up sections for shore pile bracing at any level basement work from steel plates conforming to ASTM A572, with a minimum yield strength of 345 MPa, including the cost of testing of plates, application of red/grey-oxide primer etc. all complete as per drawing, specification and direction of Engineer-in-charge. (Salvage materials shall be the contractors property after completion of work).",kg,89.0,89.0,89.0,89.0
PWD,10.11,"Supply and fixing of connection bolts of variable diameter with nut and washer according to ""ASTM A325 Type 1 or equivalent” with Fu =720 MPa, including the cost of testing of bolts, all complete as per drawing, specification and direction of Engineer-In-Charge.",kg,361.0,361.0,361.0,361.0
PWD,10.12,"Supply and fixing of connection bolts of variable diameter with nut and washer according to ""ASTM A307 Type A or equivalent” with Fu =414 MPa, including the cost of testing of bolts, all complete as per drawing, specification and direction of Engineer-In-Charge.",kg,324.0,324.0,324.0,324.0
PWD,10.13,"Supply and installation of GI purlin & girt of any size (up to level-4) conforming to ""ASTM A653"" grade 45, with a minimum yield strength of 310 MPa, including the cost of testing of materials, all complete as per drawing, specification and direction of Engineer-in-charge.",kg,164.0,163.0,164.0,164.0
PWD,10.14,"Supply and fixing of sag rod (up to level-4) conforming to grade 40, with a minimum yield strength of 275 MPa, including the cost of making threads, nuts and washers, red oxide primer etc. all complete as per drawing, specification and direction of Engineer-in-charge.",kg,158.0,158.0,158.0,158.0
PWD,10.15,"Supply and fixing of cable/wire bracing conforming to ""ASTM A475"" with a minimum yield strength of 1193 MPa, with I-bolt and hill side washer, all complete as per drawing, specification and direction of Engineer-in-charge.",meter,223.0,223.0,223.0,223.0
PWD,10.16,"Supplying and fixing of shear stud of variable dia conforming to ASTM A108 or equivalent with minimum yield strength of 275 MPa, including the cost testing, welding etc. all complete as per drawing, specification and direction of Engineer-in- charge.",kg,169.0,169.0,169.0,169.0
PWD,10.17,"Supply and installation of 0.70 mm thick galvanized decking panel according to ASTM A653, with minimum yield strength of 345 MPa, including all necessary accessories (sheeting screws with washers, sealants etc.), testing of materials etc. all complete as per drawing, specification and direction of Engineer-in-charge.",kg,186.0,186.0,186.0,186.0
PWD,10.18,"Supply, fabrication and installation of 6 mm thick Chequer Plate conforming to ASTM A572, with minimum yield strength of 345 MPa (up to level-4), including all necessary accessories, testing of materials etc. all complete as per drawing, specification and direction of Engineer-in-charge.",kg,196.0,196.0,196.0,196.0
PWD,10.19,"Supply and installation of 0.47 mm thick zinc alum color coated profile sheet from local source/China with minimum warranty period of 5 years after installation for roof, wall, caping, flashing, trimming, gutter etc. (up to level-4) conforming to ASTM A792, Grade: 80, AZM150 gm/m2, including the cost of necessary accessories (sheeting screws with washers, silicon sealant etc.), testing of materials etc. all complete as per drawing specification and direction of Engineer-in-charge.",kg,200.0,200.0,200.0,200.0
PWD,10.20,"Supply and installation of 0.47 mm thick zinc alum color coated profile sheet of durability class 2 with minimum warranty period of 10 years of durability, for roof, wall, caping, flashing, trimming, gutter etc. conforming to ASTM A792, Grade: 80, AZM150 gm/m2, including the cost of necessary accessories (sheeting screws with washers, silicon sealant etc.), testing of materials etc. all complete as per drawing specification and direction of Engineer-in-charge (supplier has to produce papers to proof the source of material).",kg,322.0,322.0,322.0,322.0
PWD,10.21,"Supply and installation of 0.457 mm thick corrugated galvanized iron sheet (Bangladesh made) having min weight 63-65 kg per bundle (2'-6"" width, 70 – 72 rft long) fitted and fixed on M.S. sections with 'J' hook or wooden purlin with screws, limpet washers and putty etc. (up to level-4) all complete and accepted by the Engineer-in-charge.",sqm,578.0,577.0,569.0,569.0
PWD,10.22.1,Galvanized,meter,472.0,471.0,459.0,459.0
PWD,10.22.2,Colored,meter,523.0,522.0,510.0,510.0
PWD,10.23,"Supply and installation of 2.0 mm thick fiber glass sheet (transparent sheet) for roof, wall etc. on M.S. purlin, angle etc. with 'J' hook or screws with washer and putty, all complete as per drawing, specification and direction of Engineer-in-charge (up to level-4).",sqm,1437.0,1436.0,1428.0,1428.0
PWD,10.24,1.5 mm thick plain fiberglass sheet ridging with 300 mm lap on either side fitted and fixed with galvanized bolts and nuts etc. all complete and accepted by the Engineer-in- charge.,meter,875.0,874.0,862.0,862.0
PWD,10.25,"Supply and installation of double bubble foil insulation at wall and roof of nominal thickness of 8 mm conforming to Class A in accordance with the ASTM-E84-09 fire test standard, including the cost of lapping, Scotch tape, adhesive and necessary accessories, all complete as per drawing, specification and direction of Engineer-in-charge.",sqm,251.0,251.0,251.0,251.0
PWD,10.26,"Premium Synthetic Enamel paint of approved best quality and colour delivered from authorized local agent of the manufacturer (Berger robbialac supergloss synthetic enamel/ Elite lucky seven/ Asian apcolipe premium paint or equivalent brand) in a sealed container, having highly water resistant, high bondibilty, flexibility property; using specified brand thinner applying to metallic surface by spray in two coats over single coat anti-corrosive coating including cleaning drying, making free from dirt, grease, wax, removing all chalked and scaled materials, all complete in all floors accepted by the Engineer-in-charge. (payment shall be made on structural steel weight basis)",kg,9.0,9.0,9.0,9.0
PWD,10.27,"Supply and application of Epoxy based corrosion protection paint to the surface of the structural steel members conforming to SA 2.5; the corrosion class shall be C3 in accordance with BS EN ISO 12944-2 and durability class in accordance with BS EN ISO 12944-5; the Steel members to be shot blasted inside the enclosed shot blasting chamber, final coat paint must be applied on site after installation, including the cost of primer, testing and necessary accessories, all complete as per drawing, specification and direction of Engineer-in-charge.",kg,26.0,26.0,26.0,26.0
PWD,10.28,"Supply and pouring of non-shrink grout to steel column bases conforming to ASTM C109 having compressive strength not less than 45 MPa, including the cost of shutter and necessary accessories, all complete as per drawing, specification and direction of Engineer-in-charge.",cum,147568.0,147568.0,147568.0,147568.0
PWD,10.29,"Safety Canopy: Supplying temporary safety canopy around construction work place where public safety is likely to be endangered due to construction activities; which shall be made of truss system of steel sections (main frame) at 1800 mm c/c with purlins @ 750 mm c/c, making flooring system by corrugated galvanized iron sheets of thickness 0.45 mm, laying wire mesh net on iron sheets, providing continuous gutter along the edges of the building with downpipe @ 6000",sqm,2429.0,2425.0,2407.0,2407.0
PWD,10.30,"Safety net with G.I Wire: Supply, fabrication, installation and taking out temporary horizontal safety net around construction work place where public safety is likely to be endangered due to construction activities; which shall be made of Chain link net with 24 BWG wire fitted at 15'-0'' height horizontally of the outer periphery of the building with 75 mm x 40 mm x 5 mm MS Chanel post and purlin, 20 mm MS Rod and 40 mm x 40 mm x 6 mm MS Angle as ties etc. by standard anchoring and welding, nut-bolts etc. all complete and accepted by the Engineer-in-charge. (Salvage materials shall be the contractors property after completion of work.)",sqm,1554.0,1541.0,1521.0,1521.0
PWD,10.31,"Safety shed over drive way: Supply, fabrication, installation and taking out temporary horizontal safety shed over the drive way around construction work place where public safety is likely to be endangered due to construction activities; which shall be made of 0.27 mm thick galvanized iron plain sheet fitted at 15'-0'' height horizontally over the drive way or path way at the outer periphery of the building with 75 mm x 40 mm x 5 mm M.S Chanel post and purlin,20 mm MS Rod and 40 mm x 40 mm x 6 mm MS Angle as ties etc. by standard anchoring and welding, nut-bolts etc. all complete and accepted by the Engineer-in-charge. (Salvage materials shall be the contractors property after completion of work.)",sqm,1677.0,1670.0,1642.0,1642.0
PWD,10.32,"Scaffolding for outside netting of building: Supplying, fitting & fixing scaffolding for outside netting of building with single layer 38 mm dia MS pipe connected each other with minimum 4'-0"" centre to centre both direction with 38 mm dia swivel clamp, including fitting and fixing in position providing necessary anchors, wires, ties etc. all complete and accepted by the Engineer-in-charge. (Rate is excluding the cost of netting)",sqm,348.0,348.0,348.0,348.0
PWD,10.33,"Safety net: Supplying temporary safety net (hessian cloth) around construction work place (along the height of the building) where public safety is likely to be endangered due to construction activities; which shall be supported using scaffolding around the building for brick work/ plaster; including fitting and fixing in position providing necessary anchors, wires, ties etc. all complete and accepted by the Engineer-in-charge. (Rate is excluding the cost of scaffolding)",sqm,51.0,51.0,50.0,50.0
PWD,10.34,"Supply, fabrication, installation and taking out of 1.2 m height temporary safety fencing at different floor during construction work around the outer periphery of building or around the punch in the floor slab for safety of the worker during construction, which shall be made of 10 mm dia MS Rod @ 450 mm c/c both way welded at each point together with a 12 mm Dia MS Rod as top rail drilled anchored to the",sqm,426.0,426.0,426.0,426.0
PWD,10.35,"Providing bearing joints fixed or free with 250 mm x 375 mm x 10 mm M.S. (Grade - A36) plate fitted in the truss angles with 16 mm diameter M.S. rod counter sunk rivets, welded and anchored to 250 x 375 x 10 mm. M.S. plate by two Nos. 19 mm dia M.S. “U” rod embedded in the bed of the lintel around the reinforcement, cleaning and greasing the joints for all floors etc. all complete and accepted by the Engineer- in-charge.",each,3055.0,3048.0,3017.0,3017.0
PWD,10.36,"Galvanization: Galvanization of finished structural steel built-up and hot rolled finished materials of any shape and size (average thickness not more than 8 mm) conforming to the requirement of the corrosion class C3 and Galvanization shall be performed in accordance with ASTM A123 all complete as per drawing, specification and direction of Engineer-in-charge.",kg,71.0,71.0,71.0,71.0
PWD,11.1.1.1,"Up to Size 0'-2.5"" x 0'-6"" (finished)",cum,135509.0,135148.0,132944.0,132944.0
PWD,11.1.1.2,"Size greater than 0'-2.5"" x 0'-6"" and up to 0'-2.5"" x 0'-11"" (finished)",cum,118023.0,117823.0,116579.0,116579.0
PWD,11.1.2.1,"Up to Size 0'-2.5"" x 0'-6"" (finished)",cum,145620.0,140204.0,145583.0,145583.0
PWD,11.1.2.2,"Size greater than 0'-2.5"" x 0'-6"" and up to 0'-2.5"" x 0'-11"" (finished)",cum,127831.0,122727.0,128839.0,128839.0
PWD,11.1.3.1,"Up to Size 0'-2.5"" x 0'-6"" (finished)",cum,160786.0,160425.0,158221.0,158221.0
PWD,11.1.3.2,"Size greater than 0'-2.5"" x 0'-6"" and up to 0'-2.5"" x 0'-11"" (finished)",cum,142543.0,142343.0,141099.0,141099.0
PWD,11.1.4.1,"Up to Size 0'-2.5"" x 0'-6"" (finished)",cum,221452.0,216035.0,221414.0,221414.0
PWD,11.1.4.2,"Size greater than 0'-2.5"" x 0'-6"" and up to 0'-2.5"" x 0'-11"" (finished)",cum,201391.0,196287.0,202398.0,202398.0
PWD,11.1.5.1,"Up to Size 0'-2.5"" x 0'-6"" (finished)",cum,256840.0,251424.0,264335.0,264335.0
PWD,11.1.5.2,"Size greater than 0'-2.5"" x 0'-6"" and up to 0'-2.5"" x 0'-11"" (finished)",cum,235719.0,230614.0,244033.0,244033.0
PWD,11.1.6.1,"Up to Size 0'-2.5"" x 0'-6"" (finished)",cum,393337.0,387921.0,395827.0,395827.0
PWD,11.1.6.2,"Size greater than 0'-2.5"" x 0'-6"" and up to 0'-2.5"" x 0'-11"" (finished)",cum,368125.0,363021.0,371585.0,371585.0
PWD,11.1.7.1,"Up to Size 0'-2.5"" x 0'-6"" (finished)",cum,186064.0,185703.0,183499.0,183499.0
PWD,11.1.7.2,"Size greater than 0'-2.5"" x 0'-6"" and up to 0'-2.5"" x 0'-11"" (finished)",cum,167063.0,166863.0,165619.0,165619.0
PWD,11.2.1,"Supplying, fitting and fixing M.S. flat bar clamp of 225 mm x 38 mm x 6 mm size having bifurcated ends to door and window frames with necessary screws including cutting grooves in chowkat if necessary and encasing inside the wall with cement concrete (1:2:4) etc. all complete and accepted by the Engineer-in-charge.",each,128.0,127.0,121.0,121.0
PWD,11.2.2,"Supplying, fitting and fixing M.S. flat bar clamp of 150 mm x 38 mm x 6 mm size having bifurcated ends to door and window frames with necessary rowel plug, screws etc. including cutting grooves in chowkat if necessary etc. all complete and accepted by the Engineer-in-charge.",each,131.0,130.0,126.0,126.0
PWD,11.3.1,"Supplying, fitting and fixing double leaf metal door frame for all floors made with 38mm x 38 mm x 6 mm M.S. angle fitted with 150 mm long 6 nos. iron clamps of same size M.S. angle (with one end bifurcated) with the vertical members of the frame, fixing the frame in wall with cement concrete (1:2:4), mending good the damages, fixing 6 Nos. of 100 mm long iron hinges with the vertical members of the frame all complete including making holes in walls, cutting, sizing, welding, fabricating, carrying from work-shop to site and local carriage, curing etc. all complete as per plan and drawing and accepted by the Engineer-in-charge.",meter,735.0,734.0,725.0,725.0
PWD,11.3.2,"Supplying, fitting and fixing single leaf metal door frame for all floors made with 38 mm x 38 mm x 6 mm M.S. angle, fixing 125 mm long 6 nos. iron clamps of same size (with one end bifurcated) with the vertical members of the frame, fixing the frame in wall with cement concrete (1:2:4), mending good the damages, fixing 4 nos. 100 mm size iron hinges with the vertical members of the frame, all complete including making holes in walls, cutting, sizing, welding, fabricating, carriage from workshop to site including local carriage, curing etc. as per plan and drawing etc. all complete and accepted by the Engineer-in–charge.",meter,712.0,711.0,701.0,701.0
PWD,11.4.1,Garjan / Jam/ Local Sal wood,cum,125547.0,120889.0,126617.0,126617.0
PWD,11.4.2,Mehgoni,cum,116447.0,116339.0,115243.0,115243.0
PWD,11.4.3,Silkarai /Chickrashi,cum,139197.0,139088.0,137992.0,137992.0
PWD,11.5.1,Mehgoni wood stair rail,cum,121568.0,121377.0,119180.0,119180.0
PWD,11.5.2,Chattogram Silkarai / Chikrashi wood stair rail,cum,144317.0,144126.0,141929.0,141929.0
PWD,11.5.3,Chattogram Teak wood stair rail,cum,230766.0,226024.0,237432.0,237432.0
PWD,11.5.4,Myanmar(Burma) Teak wood stair rail,cum,353613.0,348872.0,355775.0,355775.0
PWD,11.5.5,Jessore & other Local Teak wood stair rail,cum,167067.0,166876.0,164678.0,164678.0
PWD,12.1.1.1,Kathal (SS Fittings),sqm,9042.0,9011.0,8824.0,8824.0
PWD,12.1.1.2,Kathal (Brass Fittings),sqm,9410.0,9380.0,9192.0,9192.0
PWD,12.1.2.1,Gamari (SS Fittings),sqm,7927.0,7674.0,7932.0,7932.0
PWD,12.1.2.2,Gamari (Brass Fittings),sqm,8296.0,8042.0,8301.0,8301.0
PWD,12.1.3.1,Chattogram Teak (SS Fittings),sqm,13499.0,13246.0,13725.0,13725.0
PWD,12.1.3.2,Chattogram Teak ( Brass Fittings),sqm,13867.0,13614.0,14093.0,14093.0
PWD,12.1.4.1,Myanmar(Burma) Teak (SS Fittings),sqm,19516.0,19263.0,19521.0,19521.0
PWD,12.1.4.2,Myanmar(Burma) Teak (Brass Fittings),sqm,19885.0,19631.0,19890.0,19890.0
PWD,12.2.1.1,Chattogram Teak (SS Fittings),sqm,15685.0,15410.0,15797.0,15797.0
PWD,12.2.1.2,Chattogram Teak (Brass Fittings),sqm,15271.0,15002.0,15448.0,15448.0
